{
  "$schema": "https://raw.githubusercontent.com/ulises-jeremias/dots-ai/main/lib/schemas/skill.schema.json",
  "name": "dots-ai-project-assessment-evidence",
  "version": "1.0.0",
  "description": "WHAT: Interactive evidence intake for project assessments, including source locations, freshness, confidence, missing evidence, and validation needs.",
  "source": "bundled",
  "author": "dots-ai",
  "tags": [
    "dots-ai",
    "project-assessment",
    "evidence",
    "audit",
    "quality-indicators"
  ],
  "compatibility": {
    "universal": {
      "supported": true
    },
    "claude-code": {
      "supported": true
    },
    "pi": {
      "supported": true
    },
    "windsurf": {
      "supported": true
    },
    "opencode": {
      "supported": false
    },
    "cursor": {
      "supported": false
    },
    "copilot-cli": {
      "supported": false
    }
  }
}
