{
  "$schema": "https://raw.githubusercontent.com/ulises-jeremias/agentic-workstation/main/lib/schemas/skill.schema.json",
  "name": "dots-workstation-triage",
  "version": "1.1.0",
  "description": "Workstation health triage: validate tooling, directory layout, and run dots-doctor with remediation suggestions.",
  "source": "bundled",
  "author": "agentic-workstation",
  "tags": [
    "workstation",
    "health",
    "triage",
    "devops"
  ],
  "requires": [
    "dots-doctor"
  ],
  "compatibility": {
    "universal": {
      "supported": true
    },
    "claude-code": {
      "supported": true
    },
    "pi": {
      "supported": true
    },
    "windsurf": {
      "supported": true
    },
    "opencode": {
      "supported": false
    },
    "cursor": {
      "supported": false
    },
    "copilot-cli": {
      "supported": false
    }
  }
}
