{
  "$schema": "https://raw.githubusercontent.com/ulises-jeremias/dots-ai/main/lib/schemas/skill.schema.json",
  "name": "dots-ai-work-item",
  "version": "1.0.0",
  "description": "WHAT: Router for creating and refining epics, user stories, tasks, bugs, and incidents using dots-ai Best Practices work item hierarchy.",
  "source": "bundled",
  "author": "dots-ai",
  "tags": [
    "dots-ai",
    "work-items",
    "epic",
    "story",
    "task",
    "bug",
    "clickup"
  ],
  "compatibility": {
    "universal": {
      "supported": true
    },
    "claude-code": {
      "supported": true
    },
    "pi": {
      "supported": true
    },
    "windsurf": {
      "supported": true
    },
    "opencode": {
      "supported": false
    },
    "cursor": {
      "supported": false
    },
    "copilot-cli": {
      "supported": false
    }
  }
}
