{
  "$schema": "https://raw.githubusercontent.com/ulises-jeremias/agentic-workstation/main/lib/schemas/skill.schema.json",
  "name": "dots-workstation-decision-log",
  "version": "1.0.0",
  "description": "WHAT: Capture lightweight project, product, or operational decisions that do not require a full ADR; includes rationale, date, owner, and references.",
  "source": "bundled",
  "author": "agentic-workstation",
  "tags": [
    "agentic-workstation",
    "decision-log",
    "governance",
    "meeting",
    "clickup"
  ],
  "compatibility": {
    "universal": {
      "supported": true
    },
    "claude-code": {
      "supported": true
    },
    "pi": {
      "supported": true
    },
    "windsurf": {
      "supported": true
    },
    "opencode": {
      "supported": false
    },
    "cursor": {
      "supported": false
    },
    "copilot-cli": {
      "supported": false
    }
  }
}
