{
  "$schema": "https://raw.githubusercontent.com/ulises-jeremias/dots-ai/main/lib/schemas/skill.schema.json",
  "name": "dots-ai-trd",
  "version": "1.0.0",
  "description": "WHAT: Draft and review a TRD from the dots-ai ClickUp template, aligned to PRD and ADRs; delegates discovery to dots-ai-assistant and tickets to clickup-cli.",
  "source": "bundled",
  "author": "dots-ai",
  "tags": [
    "dots-ai",
    "trd",
    "technical-requirements",
    "architecture",
    "clickup",
    "delivery"
  ],
  "compatibility": {
    "universal": {
      "supported": true
    },
    "claude-code": {
      "supported": true
    },
    "pi": {
      "supported": true
    },
    "windsurf": {
      "supported": true
    },
    "opencode": {
      "supported": false
    },
    "cursor": {
      "supported": false
    },
    "copilot-cli": {
      "supported": false
    }
  }
}
