{
  "$schema": "https://raw.githubusercontent.com/ulises-jeremias/dots-ai/main/lib/schemas/skill.schema.json",
  "name": "dots-ai-planning",
  "version": "1.0.0",
  "description": "WHAT: Planning, estimation, task breakdown, and iteration capacity fallback based on dots-ai Best Practices; use before finalizing backlog scope or estimates.",
  "source": "bundled",
  "author": "dots-ai",
  "tags": [
    "dots-ai",
    "planning",
    "estimation",
    "capacity",
    "delivery",
    "clickup"
  ],
  "compatibility": {
    "universal": {
      "supported": true
    },
    "claude-code": {
      "supported": true
    },
    "pi": {
      "supported": true
    },
    "windsurf": {
      "supported": true
    },
    "opencode": {
      "supported": false
    },
    "cursor": {
      "supported": false
    },
    "copilot-cli": {
      "supported": false
    }
  }
}
