{
  "$schema": "https://raw.githubusercontent.com/ulises-jeremias/agentic-workstation/main/lib/schemas/skill.schema.json",
  "name": "dots-workstation-spike",
  "version": "1.0.0",
  "description": "WHAT: Produce spike and research findings using the agentic-workstation spike template; captures purpose, findings, implementation strategy, risks, tradeoffs, open questions, and references.",
  "source": "bundled",
  "author": "agentic-workstation",
  "tags": [
    "agentic-workstation",
    "spike",
    "research",
    "architecture",
    "tradeoffs"
  ],
  "compatibility": {
    "universal": {
      "supported": true
    },
    "claude-code": {
      "supported": true
    },
    "pi": {
      "supported": true
    },
    "windsurf": {
      "supported": true
    },
    "opencode": {
      "supported": false
    },
    "cursor": {
      "supported": false
    },
    "copilot-cli": {
      "supported": false
    }
  }
}
